id,title,county,state,country,source,url,summary,timestamp,category,actionable,extracted_claims,lon,lat,geometry
dae34c2b324ebb2896f8c5a27cddb707a9e927a1,Youth baseball coach arrested for sexual misconduct after victims come forward,Marion County,Florida,United States,ABC Action News,https://www.abcactionnews.com/news/region-citrus-hernando/youth-baseball-coach-arrested-for-sexual-misconduct-after-victims-come-forward-police,"John James Sales, a youth baseball coach in Ocala, was charged with lewd or lascivious molestation and conduct involving multiple underage victims in Marion and Citrus Counties. Police believe more victims may exist and are seeking tips.",2025-06-26 00:00:00+00,Crime,t,"{""Suspect arrested"",""Road blocked due to accident""}",-82.140100,29.187200,POINT(-82.1401 29.1872)
ab1f4ccd5d2abe0e2b2b9c4b4e2064e7e1c09d61,Dunnellon man arrested for DUI after crash on E. Pennsylvania Avenue,Marion County,Florida,United States,352today.com,https://352today.com/news/257752-dunnellon-man-arrested-for-dui-after-crash-on-e-pennsylvania-avenue/,"Allen Svilhik was arrested in Dunnellon following a crash on E. Pennsylvania Avenue; his breath alcohol level was .106, above the legal limit. No serious injuries were reported.",2025-06-26 11:21:00+00,Crime,t,"{""Suspect arrested"",""Road blocked due to accident""}",-82.373600,29.052300,POINT(-82.3736 29.0523)
f83d47cf5dd673c7ede2d795c8b6f123f9b5d4c1,Woman dragged out of Miami‑Dade commission meeting amid heated confusion over ICE agreement,Miami-Dade County,Florida,United States,Local10,https://www.local10.com/news/local/2025/06/26/woman-dragged-out-of-miami-dade-commission-meeting-amid-heated-confusion-over-ice-agreement/,"At a county commission meeting, a woman was forcibly removed during tense debate over an ICE enforcement agreement.",2025-06-26 16:48:00+00,Crime,t,"{""Suspect arrested"",""Road blocked due to accident""}",-80.000000,25.000000,POINT(-80 25)
2b6ec9a8acfaba4953ae1f1a4fc2560cfec3d87f,Surveillance video shows crooks ransack popular Kendall sneaker shop in seconds,Miami-Dade County,Florida,United States,Local10,https://www.local10.com/news/local/2025/06/26/surveillance-video-shows-crooks-ransack-popular-kendall-sneaker-shop-in-seconds/,"Masked thieves broke into Kick Circuit in Kendall, grabbing merchandise in seconds, captured by surveillance footage.",2025-06-26 18:43:00+00,Crime,t,"{""Suspect arrested"",""Road blocked due to accident""}",-80.000000,25.000000,POINT(-80 25)
e3c2a7b9d8f4a1e6f1234567890abcdef12345678,Broward schools to bring back cameras in special‑needs classes,Broward County,Florida,United States,Broward County Public Schools Newsroom,https://www.browardschools.com/site/default.aspx?FlexDataID=342994,Broward County Public Schools announced reinstatement of classroom cameras in special‑needs classes across multiple schools starting this week.,2025-06-26 00:00:00+00,Crime,t,"{""Suspect arrested"",""Road blocked due to accident""}",-80.200000,26.100000,POINT(-80.2 26.1)
d1eebc0e6d1a473cfb58d3b8eccc4c1b972d2237,"Florida father, son rescued from gator‑infested waters of Lake Thonotosassa",Hills-Borough County,Florida,United States,FOX 13 News,https://www.fox13news.com/news/florida-father-son-rescued-from-gator‑infested‑waters‑lake‑thonotosassa‑after‑jet‑skis‑broke‑down,"Hillsborough County deputies rescued a father and son from a broken‑down jet ski surrounded by alligators on Lake Thonotosassa, bringing them safely to shore.",2025-06-26 23:15:00+00,Crime,t,"{""Suspect arrested"",""Road blocked due to accident""}",-82.300000,28.050000,POINT(-82.3 28.05)
3fa2a7ebd79f8bcaf4d3d4c4a9980dfa1cb29458,Hillsborough County Traffic Alert: Extensive Lane Closures Expected Next Week,Hills-Borough County,Florida,United States,TampaFP,https://www.tampafp.com/hillsborough-county-traffic-alert-extensive-lane-closures-expected-next-week/,FDOT District 7 plans extensive lane closures across Hillsborough County highways from June 29 to July 5 for maintenance and construction.,2025-06-27 00:00:00+00,Crime,t,"{""Suspect arrested"",""Road blocked due to accident""}",-82.460000,27.950000,POINT(-82.46 27.95)
c9956a3e8b2f7522183c1d3da4f494a4776b8f01,Cloudy or clear? Taylor County residents raise concerns about the quality of their water,Taylor County,Florida,United States,WCTV,https://www.wctv.tv/2025/06/27/cloudy-or-clear-taylor-county-residents-raise-concerns-about-quality-their-water/,"Residents in Perry report intermittent brown, murky tap water tied to aging water systems and decreased flow following the mill closure; city responds with hydrant flushing and seeks new well locations.",2025-06-27 02:31:00+00,Crime,t,"{""Suspect arrested"",""Road blocked due to accident""}",-83.581500,30.057200,POINT(-83.5815 30.0572)
e2f6a1d9f3b7cfa0d5de8b2ed9e4e1a2c3b4d5f6,"Passenger ejected and killed in Taylor County SUV crash, FHP says",Taylor County,Florida,United States,Ground News,https://ground.news/interest/taylor-county-florida/passenger-ejected-and-killed-in-suv-crash-fhp-says,"A passenger was killed after being ejected when their SUV spun out and overturned on U.S. Hwy 19 near Athena in Taylor County, according to Florida Highway Patrol.",2025-06-26 18:00:00+00,Crime,t,"{""Suspect arrested"",""Road blocked due to accident""}",-83.600000,30.100000,POINT(-83.6 30.1)
