id,title,county,state,country,source,url,summary,timestamp,category,actionable,extracted_claims,lon,lat,geometry
8d2f42377b4fb6f5a6d1e743d5e0f2c13817c2d3,Chaos at Miami‑Dade commission as officers drag out objector to new ICE jails agreement,Miami-Dade County,Florida,United States,Miami Herald,https://www.miamiherald.com/news/local/community/miami-dade/article309387990.html,"At a Miami‑Dade County Commission meeting, deputies forcibly removed a woman objecting to an ICE‑jail agreement, sparking chaos as protesters chanted “let her speak.”",2025-06-26 00:00:00+00,Crime,t,"{""Suspect arrested"",""Road blocked due to accident""}",-80.191800,25.761700,POINT(-80.1918 25.7617)
3c4a1f9e2bbd7ce4f14bb6aeaf70e9c6e69c4832,Shocking scenes as woman dragged out of meeting for trying to speak during hearing on ICE rules,Miami-Dade County,Florida,United States,The Independent,https://www.independent.co.uk/news/world/americas/us-politics/ice-protest-miami-dade-florida-b2777790.html,Video showed Camila Ramos being manhandled by Miami‑Dade deputies after attempting to speak against an ICE‑jail deal during a county meeting.,2025-06-26 19:58:00+00,Crime,t,"{""Suspect arrested"",""Road blocked due to accident""}",-80.191800,25.761700,POINT(-80.1918 25.7617)
b5b72d04e2e8c3a3d2f04b8b264e1a039c4e2d1a,She wanted to speak against an ICE deal with Miami‑Dade. She ended up in jail instead,Miami-Dade County,Florida,United States,Miami Herald,https://www.miamiherald.com/news/local/immigration/article309498520.html,Camila Ramos spoke against an ICE‑county jail deal at the commission meeting and was subsequently detained by deputies.,2025-06-26 00:00:00+00,Crime,t,"{""Suspect arrested"",""Road blocked due to accident""}",-80.191800,25.761700,POINT(-80.1918 25.7617)
f35e564c8723a5ed1a8f2e3b6c4d18a5b6c7d8e9,"BSO arrests Miami‑Dade deputy on armed kidnapping, domestic violence charges",Miami-Dade County,Florida,United States,Miami Herald,https://www.miamiherald.com/news/local/community/miami-dade/article309478660.html,Broward Sheriff's Office arrested a Miami‑Dade deputy in Pompano Beach on armed kidnapping and domestic violence charges.,2025-06-26 00:00:00+00,Crime,t,"{""Suspect arrested"",""Road blocked due to accident""}",-80.124800,26.237900,POINT(-80.1248 26.2379)
7c3f4ebea1b4239f384dba5c2f07fe0c1b7b5e19,"Woman accused of $21k theft spree across Palm Beach, St. Lucie, Martin, & Broward Co.",Palm Beach County,Florida,United States,CBS12,https://cbs12.com/news/crime/woman-accused-of-21k-theft-spree-across-palm-beach-st-lucie-martin-broward-co,"A woman was arrested for allegedly stealing $21,000 across multiple counties including Palm Beach.",2025-06-25 08:00:00+00,Crime,t,"{""Suspect arrested"",""Road blocked due to accident""}",-80.053400,26.715300,POINT(-80.0534 26.7153)
a391d4c8afbbfa7f83bd1dcb9d718f5d845ab0f4,Brothers arrested after $10k rampage at Jupiter barber shop over job dispute,Palm Beach County,Florida,United States,CBS12,https://cbs12.com/news/crime/brothers-arrested-after-10k-rampage-at-jupiter-barber-shop-over-job-dispute,"Two brothers were arrested after causing $10,000 in damage at a Jupiter barber shop during a job-related dispute.",2025-06-26 02:00:00+00,Crime,t,"{""Suspect arrested"",""Road blocked due to accident""}",-80.094200,26.934200,POINT(-80.0942 26.9342)
d1e2f3c4b5a697887766554433221100ffeeddcc,‘He is dangerous’: Police identify suspect in Boynton Beach double murder,Palm Beach County,Florida,United States,CBS12,https://cbs12.com/news/crime/he-is-dangerous-police-identify-suspect-in-boynton-beach-double-murder,Police are seeking a dangerous suspect in connection with a double homicide in a Boynton Beach Leisureville home.,2025-06-25 20:00:00+00,Crime,t,"{""Suspect arrested"",""Road blocked due to accident""}",-80.090000,26.531000,POINT(-80.09 26.531)
9f8e7d6c5b4a3e2f1d0c1234567890abcdef1234,"Once red-hot, South Florida's real estate market is in a months‑long slump",Palm Beach County,Florida,United States,New York Post,https://nypost.com/2025/06/26/real-estate/south-floridas-residential-market-is-in-a-months-long-slump/,"Real estate sales in Palm Beach County fell ~12% year‑over‑year in May amid high rates, insurance and condo fees.",2025-06-26 18:43:59+00,Crime,t,"{""Suspect arrested"",""Road blocked due to accident""}",-80.036400,26.705600,POINT(-80.0364 26.7056)
1c3a4b2d9febb907d8a2dbe1c5a32fe5b9d0e4e6,"Man arrested for lewd exposure at Ocala Dollar General, deputies say",Marion County,Florida,United States,352today.com,https://352today.com/news/257752-man-arrested-for-lewd-exposure-at-ocala-dollar-general-deputies-say/,Phillip Jones was arrested after deputies say he exposed himself inside a Dollar General in Ocala; identified via surveillance footage and booked into Marion County Jail.,2025-06-26 07:18:00+00,Crime,t,"{""Suspect arrested"",""Road blocked due to accident""}",-82.140100,29.187200,POINT(-82.1401 29.1872)
e4d5f6a7b8c9d1e2f3a4b5c6d7e8f9a012345678,Handcuffed Florida woman opened fire on deputy during ride to jail,Marion County,Florida,United States,CBS12,https://cbs12.com/news/local/handcuffed-florida-woman-opened-fire-on-deputy-during-ride-to-jail-florida-woman-marion-county-convicted-felon-crime-deputy-crash-shoot-opened-fire-june-25-2025,"Rheanna Harden, handcuffed in patrol car, retrieved a hidden firearm and shot at a Marion County deputy, grazing him; car crashed and deputy returned fire. She remains jailed without bond.",2025-06-25 10:00:00+00,Crime,t,"{""Suspect arrested"",""Road blocked due to accident""}",-82.140100,29.187200,POINT(-82.1401 29.1872)
d4c5e8a391b47ec3f2e9a4c6b5d7e8f9a0b1c2d3,Suspect in Miami hit‑and‑run unconscious for weeks after hospital clash with cops,Miami-Dade County,Florida,United States,Miami Herald,https://www.miamiherald.com/news/local/crime/article309313885.html,A suspect in a fatal Shenandoah hit‑and‑run remains unconscious at Jackson Memorial after a violent confrontation with police.,2025-06-26 00:00:00+00,Crime,t,"{""Suspect arrested"",""Road blocked due to accident""}",-80.210600,25.823500,POINT(-80.2106 25.8235)
a0b1c2d3e4f5b6a7c8d9e0f1a2b3c4d5e6f7g8h,"It’s official: Miami cancels November election, postpones it to 2026",Miami-Dade County,Florida,United States,Miami Herald,https://www.miamiherald.com/news/local/community/miami-dade/article309065285.html,Miami voters will skip the November 2025 election as local officials shift to even‑year cycles beginning in 2026 to boost turnout.,2025-06-26 00:00:00+00,Crime,t,"{""Suspect arrested"",""Road blocked due to accident""}",-80.191800,25.761700,POINT(-80.1918 25.7617)
c2d3e4f5b6a7c8d9e0f1a2b3c4d5e6f7g8h9i0j,Canadian man awaiting deportation dies at detention facility in downtown Miami,Miami-Dade County,Florida,United States,Miami Herald,https://www.miamiherald.com/news/local/immigration/article309501470.html,"Johnny Noviello, a Canadian citizen in ICE custody, died at a Miami detention center—his death marks the fourth in ICE custody in Florida this year.",2025-06-26 00:00:00+00,Crime,t,"{""Suspect arrested"",""Road blocked due to accident""}",-80.193700,25.774300,POINT(-80.1937 25.7743)
e4f5b6a7c8d9e0f1a2b3c4d5e6f7g8h9i0j1k2l,Miami delays vote on whether to give Olympia Theater to charter school,Miami-Dade County,Florida,United States,Miami Herald,https://www.miamiherald.com/news/local/community/miami-dade/article309476635.html,Miami officials postponed a decision on transferring the historic Olympia Theater to a charter school amid public opposition.,2025-06-26 00:00:00+00,Crime,t,"{""Suspect arrested"",""Road blocked due to accident""}",-80.190100,25.782400,POINT(-80.1901 25.7824)
f5b6a7c8d9e0f1a2b3c4d5e6f7g8h9i0j1k2l3m,Rising Florida heat cutting into this exotic fruit’s already short and sweet season,Miami-Dade County,Florida,United States,Miami Herald,https://www.miamiherald.com/news/local/environment/climate-change/article309037635.html,"Heat waves in South Florida are shortening the lychee picking season, impacting farmers in Miami‑Dade.",2025-06-26 00:00:00+00,Crime,t,"{""Suspect arrested"",""Road blocked due to accident""}",-80.400000,25.500000,POINT(-80.4 25.5)
a7c8d9e0f1a2b3c4d5e6f7g8h9i0j1k2l3m4n5,Florida National Guard troops to offer security in ‘Alligator Alcatraz’ starting next week,Miami-Dade County,Florida,United States,Miami Herald,https://www.miamiherald.com/news/local/immigration/article309498645.html,The Florida National Guard will deploy 100 troops to secure an immigration detention center in the Everglades dubbed “Alligator Alcatraz.”,2025-06-26 00:00:00+00,Crime,t,"{""Suspect arrested"",""Road blocked due to accident""}",-80.898700,25.286600,POINT(-80.8987 25.2866)
5e9a2c4bdf8a9e13baa47d02ae8cd1609b7f872a,1 dead after attempted murder‑suicide in Riviera Beach,Palm Beach County,Florida,United States,WPTV,https://www.wptv.com/news/palm-beach-county/region-c-palm-beach-county/1-dead-after-attempted-murder-suicide-in-riviera-beach,One person was killed and another critically injured in an attempted murder‑suicide incident in Riviera Beach.,2025-06-26 10:27:00+00,Crime,t,"{""Suspect arrested"",""Road blocked due to accident""}",-80.294300,26.771300,POINT(-80.2943 26.7713)
b3c4f1d52e8772c07a3c8cf5a8b1345c2d6f5e90,West Palm Beach police union: 7 officers fired after pursuit that killed 2 women,Palm Beach County,Florida,United States,WPTV,https://www.wptv.com/news/palm-beach-county/region-c-palm-beach-county/wpbpd-union-7-officers-fired-after-pursuit-killed-2-women,Police union reports seven West Palm Beach officers were terminated following a pursuit that resulted in the deaths of two women.,2025-06-26 09:15:00+00,Crime,t,"{""Suspect arrested"",""Road blocked due to accident""}",-80.053400,26.715300,POINT(-80.0534 26.7153)
a927e5d413cb04fd6d2f90b8a84161472d4c1f3b,Riviera Beach police prepare for summer crime surge,Palm Beach County,Florida,United States,WPTV,https://www.wptv.com/news/palm-beach-county/region-c-palm-beach-county/riviera-beach-police-prepare-for-summer-crime-surge,Riviera Beach police are ramping up patrols and community outreach ahead of expected summer crime increases.,2025-06-26 08:05:00+00,Crime,t,"{""Suspect arrested"",""Road blocked due to accident""}",-80.258000,26.208000,POINT(-80.258 26.208)
c2f9c29fc8ec0b2c9f8f74c05c15a5ac9b584d1f,"Avow selected to provide hospice care in Lee, Glades and Hendry counties",Hendry County,Florida,United States,Cape Coral Breeze,https://www.capecoralbreeze.com/news/business/2025/06/26/avow-selected-to-provide-hospice-care-in-lee-glades-and-hendry-counties-2/,"Avow received preliminary approval to expand hospice services into Hendry County, enhancing palliative and end‑of‑life care access under a state health agency certificate.",2025-06-26 00:00:00+00,Crime,t,"{""Suspect arrested"",""Road blocked due to accident""}",-81.207000,26.773000,POINT(-81.207 26.773)
05fb5b9f2f8c969a0b1a3031f0e0bdedf9c2ce4a,Florida expands citrus black spot quarantine to two new counties,Hendry County,Florida,United States,FreshPlaza,https://www.freshplaza.com/north-america/article/9744778/florida-expands-citrus-black-spot-quarantine-to-two-new-counties/,USDA and Florida agriculture officials added seven sections in Hendry County to the citrus black spot quarantine to control fungal disease spread in Southwest Florida.,2025-06-26 00:00:00+00,Crime,t,"{""Suspect arrested"",""Road blocked due to accident""}",-81.130000,26.680000,POINT(-81.13 26.68)
1d4b3f0cb6e2a0505a7e8cf9f18a7919f1a6e2b9,Jury reviews black box recordings in Labelle hit‑and‑run that killed teen,Hendry County,Florida,United States,Fox 4,https://www.fox4now.com/labelle/jury-reviews-black-box-recordings-in-labelle-hit-and-run-that-killed-teen,"During trial in LaBelle, jurors examined black box data and surveillance showing SUV speeding over 75 mph causing the fatal hit‑and‑run that killed 15‑year‑old Eduardo Escobedo.",2025-06-26 00:00:00+00,Crime,t,"{""Suspect arrested"",""Road blocked due to accident""}",-81.371000,26.813100,POINT(-81.371 26.8131)
4e0b5e2c6c3f8f8dae2b079ed0a69e2a3c9bf1fa,Sarasota County works to clear 180 miles of ditches before hurricane season ramps up,Sarasota County,Florida,United States,FOX 13 Tampa Bay,https://www.fox13news.com/tag/us/fl/sarasota-county,"Sarasota County crews began clearing 180 miles of drainage ditches ahead of hurricane season, targeting areas off Bell Avenue to reduce flood risk and ensure stormwater flow.",2025-06-26 17:44:00+00,Crime,t,"{""Suspect arrested"",""Road blocked due to accident""}",-82.530700,27.338600,POINT(-82.5307 27.3386)
b6e4fd603be2a9a628e8f740a21c87a7f20dcdee,Miami cop charged for giving ex false traffic ticket while she was overseas,Miami-Dade County,Florida,United States,Local10,https://www.local10.com/news/local/2025/06/26/miami-cop-charged-for-giving-ex-false-traffic-ticket-while-she-was-overseas-authorities-say/,A Miami police officer is facing criminal charges for issuing a false traffic ticket to his ex‑girlfriend while she was overseas.,2025-06-26 11:22:00+00,Crime,t,"{""Suspect arrested"",""Road blocked due to accident""}",-80.000000,25.000000,POINT(-80 25)
9f73d982e05637374eb8b8e27c0bb07c74c8a0c1,Bodycam video shows aftermath of fatal police shooting in Redland,Miami-Dade County,Florida,United States,NBC Miami,https://www.nbcmiami.com/news/local/bodycam-video-shows-aftermath-of-fatal-police-shooting-in-redland/3646773/,Newly released body‑cam footage captures tense moments after a fatal police shooting in the Redland area of Miami‑Dade.,2025-06-26 20:26:00+00,Crime,t,"{""Suspect arrested"",""Road blocked due to accident""}",-80.000000,25.000000,POINT(-80 25)
c5a9d6a05c06da3efecb66b8dcf2c9166687e6cd,Miami‑Dade warehouse faces $9 million foreclosure,Miami-Dade County,Florida,United States,South Florida Business Journal,https://www.bizjournals.com/southflorida/news/2025/06/26/miami-dade-warehouse-faces-foreclosure.html,"A warehouse in Westgate, Miami‑Dade County, is facing a $9.25 million foreclosure lawsuit.",2025-06-26 00:00:00+00,Crime,t,"{""Suspect arrested"",""Road blocked due to accident""}",-80.000000,25.000000,POINT(-80 25)
2da3f7e0a8c2201a3a710fc090f9df795c8c597b,31 Arrested in South Florida Gun and Drug Trafficking Cases,Miami-Dade County,Florida,United States,Florida Daily,https://floridadaily.com/31-arrested-in-south-florida-gun-and-drug-trafficking-cases/,A federal operation resulted in 31 arrests in South Florida tied to gun and drug trafficking networks.,2025-06-26 00:00:00+00,Crime,t,"{""Suspect arrested"",""Road blocked due to accident""}",-80.000000,25.000000,POINT(-80 25)
d6513e7b8f7ea1c30f7cc2aedb4e0d0e0d8f1c2a,"Miccosukee Tribe member turned in by mother after stabbing man at reservation store, feds say",Miami-Dade County,Florida,United States,Local10,https://www.local10.com/news/local/2025/06/26/miccosukee-tribe-member-turned-in-by-mother-after-stabbing-man-at-reservation-store-feds-say/,An adult Miccosukee Tribe member was arrested and charged after his mother turned him in over a stabbing at a reservation store.,2025-06-26 00:00:00+00,Crime,t,"{""Suspect arrested"",""Road blocked due to accident""}",-80.000000,25.000000,POINT(-80 25)
a3b5cde8f1f4d2a7c5e6f3b8d9a0123456789012,"Miami‑Dade deputy arrested on kidnapping, domestic violence charges in Broward, BSO says",Broward County,Florida,United States,CBS Miami,https://www.cbsnews.com/miami/tag/broward-county/,"CBS Miami reports a Miami‑Dade deputy was arrested in Broward County on kidnapping and domestic violence charges, according to Broward Sheriff’s Office.",2025-06-26 03:00:00+00,Crime,t,"{""Suspect arrested"",""Road blocked due to accident""}",-80.000000,26.000000,POINT(-80 26)
e47d7b5b845f1d8472e7a8f7c8e6f4d827a3ae12,"Woman accused of $21k theft spree across Palm Beach, St. Lucie, Martin, & Broward Co.",Palm Beach County,Florida,United States,CBS12,https://cbs12.com/news/local/woman-charged-with-21k-theft-spree-across-palm-beach-st-lucie-martin-broward-county-florida-attorney-general-james-uthmeier-south-florida-news-june-25-2025,"Zatorya Daniels is charged with organized retail theft after allegedly stealing $21,066 worth of merchandise in 16 thefts across four counties, including Palm Beach. Authorities say she targeted Ulta and Walgreens stores with accomplices. If convicted, she faces up to 30 years in prison.",2025-06-25 00:00:00+00,Crime,t,"{""Suspect arrested"",""Road blocked due to accident""}",-80.053400,26.715300,POINT(-80.0534 26.7153)
3a2b10f6a9c3e4d5b7c8d9a0e1f203456789abcd,‘He is dangerous’: Police identify suspect in Boynton Beach double murder,Palm Beach County,Florida,United States,NBC Miami/CBS12,https://www.nbcmiami.com/news/local/manhunt-underway-for-suspect-who-gunned-down-man-and-woman-in-boynton-beach-police/264691/,Boynton Beach police identified and are seeking a suspect in the shooting deaths of two 63-year-olds at a Leisureville home on SW 17th Street. Authorities warn the suspect is “dangerous” and patrols in the area have been increased.,2025-06-25 00:00:00+00,Crime,t,"{""Suspect arrested"",""Road blocked due to accident""}",-80.066000,26.533000,POINT(-80.066 26.533)
3fcd8b9ea2dc52af1cbf9f0e1bfedafcd1a4e2e5,Wells Fargo Bank Robber Arrested,Sarasota County,Florida,United States,Sarasota County Sheriff's Office,https://www.sarasotasheriff.org/news_detail_T13_R221.php,"Bradenton man Ray Frierson arrested in armed robbery of Sarasota Wells Fargo branch; stolen vehicle from employer used, $500k bond set.",2025-06-26 14:00:00+00,Crime,t,"{""Suspect arrested"",""Road blocked due to accident""}",-82.490000,27.330000,POINT(-82.49 27.33)
a5b3f1d4e7c8a9b2f1d3e4c5b6a7d8e9f0b1c2d3,Miami‑Dade mom charged in daughter's 2023 accidental shooting takes plea deal,Miami-Dade County,Florida,United States,NBC 6 South Florida,https://www.nbcmiami.com/tag/crime-and-courts/,A Miami‑Dade woman pleaded guilty for a 2023 incident in northwest Miami‑Dade when her child accidentally shot her 4‑year‑old daughter; plea resolves case.,2025-06-24 17:45:00+00,Crime,t,"{""Suspect arrested"",""Road blocked due to accident""}",-80.341600,25.857000,POINT(-80.3416 25.857)
d9c0e7a8b6c5d4e3f2a1b0c9d8e7f6a5b4c3d2e1,"FBI’s 'Operation Viper' arrests 65, seizes 21 firearms across South Florida",Miami-Dade County,Florida,United States,WLRN,https://www.wlrn.org/south-florida/2025-06-25/fbi-operation-viper-south-florida-most-violent-suspected-criminals-arrested,"FBI’s Miami office, with local agencies, arrested 65 suspects and seized 21 firearms—including illegal automatic modifiers—across Miami‑Dade in ‘Operation Viper.’",2025-06-25 22:56:00+00,Crime,t,"{""Suspect arrested"",""Road blocked due to accident""}",-80.303700,25.986100,POINT(-80.3037 25.9861)
b2a3c4d5e6f7a8b9c0d1e2f3a4b5c6d7e8f9a0b1,Police search for suspected armed robber who robbed Miami business,Miami-Dade County,Florida,United States,Local 10,https://www.local10.com/news/local/2025/06/24/caught-on-camera-suspect-sought-in-armed-robbery-at-miami-business/,Miami Police investigate a knife‑point armed robbery at a local business—suspect seen on camera fleeing with cash and a gold bracelet.,2025-06-24 16:42:00+00,Crime,t,"{""Suspect arrested"",""Road blocked due to accident""}",-80.191800,25.761700,POINT(-80.1918 25.7617)
ed0a3ca9b892b1e5d15f46f4fc2d8f6d7af7b2a5,Police: Man shot outside UPS facility in Hialeah,Miami-Dade County,Florida,United States,Local10,https://www.local10.com/news/local/police-man-shot-outside-ups-facility-in-hialeah,A man was shot outside a UPS facility in Hialeah early Thursday morning; police are questioning multiple people in connection.,2025-06-26 03:00:00+00,Crime,t,"{""Suspect arrested"",""Road blocked due to accident""}",-80.278100,25.857600,POINT(-80.2781 25.8576)
b5f89c3d2e6a5f1c4d0a9e7a2b3c4d5e6f7a8b9c,Driver tackled in middle of Palmetto Expressway during FHP chase,Miami-Dade County,Florida,United States,Local10,https://www.local10.com/news/local/driver-tackled-palmetto-expressway-fhp-chase,"Florida Highway Patrol chased and tackled a driver on the Palmetto Expressway near SW 8th St, temporarily halting traffic.",2025-06-25 23:00:00+00,Crime,t,"{""Suspect arrested"",""Road blocked due to accident""}",-80.300000,25.750000,POINT(-80.3 25.75)
c1a2b3d4e5f6a7b8c9d0e1f2a3b4c5d6e7f8a9b0,"Miami‑Dade man accused of strangling wife, striking daughter during laundry dispute",Miami-Dade County,Florida,United States,Local10,https://www.local10.com/news/local/miami-dade-man-accused-strangling-wife-striking-daughter-laundry-dispute,A 61‑year‑old Miami‑Dade man allegedly strangled his wife and struck his daughter amid a laundry dispute at their Kendall West home.,2025-06-25 22:00:00+00,Crime,t,"{""Suspect arrested"",""Road blocked due to accident""}",-80.350000,25.700000,POINT(-80.35 25.7)
d2e3f4a5b6c7d8e9f0a1b2c3d4e5f6a7b8c9d0e1,Surveillance video shows crooks ransack popular Kendall sneaker shop,Miami-Dade County,Florida,United States,Local10,https://www.local10.com/news/local/surveillance-video-shows-crooks-ransack-kendall-sneaker-shop,Surveillance footage captures thieves quickly ransacking a sneaker shop in Kendall; police are reviewing images to identify suspects.,2025-06-26 01:00:00+00,Crime,t,"{""Suspect arrested"",""Road blocked due to accident""}",-80.348900,25.700500,POINT(-80.3489 25.7005)
d3b07384d113edec49eaa6238ad5ff00abcdef12,Victims want answers after triple shooting in Fort Lauderdale,Broward County,Florida,United States,Local10,https://www.local10.com/news/local/2025/06/24/victims-want-answers-after-triple-shooting-in-fort-lauderdale/,"Three people were shot early Sunday on the top level of a Fort Lauderdale parking garage off East Las Olas Circle; one victim, 19, remains in critical condition after surgeries. Authorities seek witness information.",2025-06-24 18:17:00+00,Crime,t,"{""Suspect arrested"",""Road blocked due to accident""}",-80.000000,26.000000,POINT(-80 26)
0cc175b9c0f1b6a831c399e269772661fedcba98,"FBI, local agencies announce results of 'Operation Viper' in Miramar",Broward County,Florida,United States,Local10,https://www.local10.com/news/local/2025/06/25/fbi-miami-local-agencies-announce-results-of-operation-viper-targeting-violent-offenders/,"Operation Viper, a two‑month FBI‑led campaign in South Florida, led to 65 arrests and 21 firearms seized in high‑crime neighborhoods including Miramar and Fort Lauderdale.",2025-06-25 00:00:00+00,Crime,t,"{""Suspect arrested"",""Road blocked due to accident""}",-80.000000,26.000000,POINT(-80 26)
f20e4c53b0e2a29b531b39b95a4a04f8b3a13f08,Manhunt underway for suspect who gunned down man and woman in Boynton Beach: Police,Palm Beach County,Florida,United States,NBC Miami,https://www.nbcmiami.com/news/local/man-wanted-for-gunning-down-63-year-old-man-woman-in-boynton-beach-police/3646367/,"Police are searching for 32‑year‑old Jyuno Alexander Daniels after he allegedly shot and killed a man and woman, both 63, in their Boynton Beach home following a reported dispute.",2025-06-26 04:00:00+00,Crime,t,"{""Suspect arrested"",""Road blocked due to accident""}",-80.066700,26.533300,POINT(-80.0667 26.5333)
f2d5b3c4e9a7316ab7c78f207e92d3e8a7c6a56a,Youth baseball coach arrested for sex crimes against teen boys in Ocala,Marion County,Florida,United States,WCJB,https://www.wcjb.com/2025/06/26/youth-baseball-coach-arrested-sex-crimes-against-minors-ocala/,"John Sales, 29, a youth baseball coach in Ocala, has been arrested on multiple charges of lewd or lascivious molestation involving teenage boys, stemming from incidents reported since March.",2025-06-26 13:19:00+00,Crime,t,"{""Suspect arrested"",""Road blocked due to accident""}",-82.140100,29.187200,POINT(-82.1401 29.1872)
6a4d8e1c9bf5223c8a3e06d4b5a1fcd70d4e5b2f,‘He wouldn’t be able to call 911’: iPhone helps save man’s life after trapped inside crashed truck,Marion County,Florida,United States,WESH (via ABC17),https://abc17news.com/news/2025/06/26/he-wouldnt-be-able-to-call-911-iphone-helps-save-mans-life-after-trapped-inside-crashed-truck/,"Marion County Fire Rescue credits an iPhone’s Emergency SOS crash detection for alerting 911 and sending precise location, enabling crews to rescue a man trapped in a flipped pickup truck near Ocala.",2025-06-26 15:00:00+00,Crime,t,"{""Suspect arrested"",""Road blocked due to accident""}",-82.140100,29.187200,POINT(-82.1401 29.1872)
a3e6c9f7d5b812e4c3a92e6b8f4a7d2e5c1b0f4d,"Marion County Public Library holds Robert E. Browning Jr. awards ceremony, recognizing accomplishments in wildfire safety",Marion County,Florida,United States,WCJB,https://www.wcjb.com/2025/06/26/marion-county-public-library-holds-robert-e-browning-jr-awards-ceremony-recognizing-accomplishments-wildfire-safety/,"The Marion County Public Library in Ocala hosted the Robert E. Browning Jr. ceremony, honoring wildfire safety efforts and featuring Smokey Bear to educate children about early 2025 wildfire season.",2025-06-26 23:13:00+00,Crime,t,"{""Suspect arrested"",""Road blocked due to accident""}",-82.140100,29.187200,POINT(-82.1401 29.1872)
c2a5f62df8f8e3e8c59b4844cf2f4bdeaf475e99,Sarasota County works to clear 180 miles of ditches before hurricane season ramps up,Sarasota County,Florida,United States,FOX13 Tampa Bay,https://www.fox13news.com/news/sarasota-county-works-clear-180-miles-ditches-before-hurricane-season-ramps-up,Crews and contractors are clearing 180 miles of roadside ditches to reduce flooding risk ahead of hurricane season in Sarasota County.,2025-06-26 17:44:00+00,Crime,t,"{""Suspect arrested"",""Road blocked due to accident""}",-82.530000,27.330000,POINT(-82.53 27.33)
